{
  "version": "0.1.0-draft",
  "review_status": "draft, belum ditinjau klinisi",
  "symptoms": [
    { "code": "urine_orange", "level": "GREEN", "label_id": "Kencing berwarna merah atau oranye" },
    { "code": "nausea_mild", "level": "GREEN", "label_id": "Mual ringan setelah minum obat" },
    { "code": "joint_ache_mild", "level": "GREEN", "label_id": "Nyeri sendi ringan" },
    { "code": "appetite_loss", "level": "GREEN", "label_id": "Kurang nafsu makan" },
    { "code": "tingling_feet", "level": "YELLOW", "label_id": "Kesemutan atau rasa terbakar di kaki" },
    { "code": "itching_no_rash", "level": "YELLOW", "label_id": "Gatal tanpa ruam" },
    { "code": "jaundice", "level": "RED", "label_id": "Mata atau kulit kuning" },
    { "code": "vision_change", "level": "RED", "label_id": "Penglihatan kabur atau warna berubah" },
    { "code": "skin_rash", "level": "RED", "label_id": "Ruam kulit" },
    { "code": "vomiting_repeated", "level": "RED", "label_id": "Muntah berulang" },
    { "code": "confusion", "level": "RED", "label_id": "Bingung atau linglung" }
  ],
  "duration_rules": [
    { "codes": ["nausea_mild", "appetite_loss"], "min_days": 7, "level": "YELLOW" }
  ],
  "unknown_level": "YELLOW",
  "levels": {
    "GREEN": {
      "action_id": "Tetap minum obat sesuai jadwal.",
      "message_id": "Keluhan ini umum terjadi dan biasanya berkurang dalam 2 sampai 4 minggu."
    },
    "YELLOW": {
      "action_id": "Tetap minum obat sesuai jadwal. Perawat akan menghubungi Anda dalam 1 hari kerja.",
      "message_id": "Keluhan ini perlu diperiksa oleh perawat."
    },
    "RED": {
      "action_id": "Berhenti dulu dan segera ke Puskesmas atau IGD hari ini.",
      "message_id": "Keluhan ini perlu diperiksa petugas kesehatan hari ini. Perawat sudah diberi tahu."
    }
  },
  "fallback_warning_id": "Kalau ada mata/kulit kuning, ruam, atau gangguan penglihatan, segera ke Puskesmas."
}
